{
    "name": "rozklad-bot",
    "version": "1.10",
    "debug": false,
    "port": 8000,
    "timeout_seconds": 2.5,
    "language": "uk",
    "admins": ["olena", "andrii", "maryna"],
    "database": {
      "host": "localhost",
      "port": 5432,
      "name": "rozklad",
      "password_env": "DB_PASSWORD"
    }
  }